{
	"$schema": "What Sportivista COVERS (not what any one person follows). AI-managed compass for the research/verify/coverage agents and the server coverage filter (build-events.js isCovered). Personal precision lives in each user's on-device lens, never here. tier1 = sports covered wholesale; tier2 = the named entity long-tail (athletes/teams/tournaments). Server breadth is safe for the calm dashboard because each user's on-device lens filters the catalog-wide board down to what THEY follow — so we cover broadly to anticipate possible interests (WP-116). chess and esports stay entity-gated (only a named catalog entity admits an event); tennis is admitted via its majors/marquee tournaments + tracked names.",
	"language": "nb-NO",
	"timezone": "Europe/Oslo",
	"tier1": [
		"football",
		"golf",
		"f1",
		"cycling",
		"athletics",
		"handball",
		"biathlon",
		"cross-country",
		"alpine",
		"nordic",
		"ski jumping"
	],
	"tier2": {
		"athletes": [
			{ "name": "Viktor Hovland", "aliases": ["Hovland"], "sport": "golf" },
			{ "name": "Kristoffer Ventura", "aliases": ["Ventura"], "sport": "golf" },
			{ "name": "Kristoffer Reitan", "aliases": ["Reitan"], "sport": "golf" },
			{ "name": "Casper Ruud", "aliases": ["Ruud"], "sport": "tennis" },
			{ "name": "Jakob Ingebrigtsen", "aliases": ["Ingebrigtsen"], "sport": "athletics" },
			{ "name": "Karsten Warholm", "aliases": ["Warholm"], "sport": "athletics" },
			{ "name": "Markus Rooth", "aliases": ["Rooth"], "sport": "athletics" },
			{ "name": "Sondre Guttormsen", "aliases": ["Guttormsen"], "sport": "athletics" },
			{ "name": "Henriette Jæger", "aliases": ["Jæger"], "sport": "athletics" },
			{ "name": "Sander Sagosen", "aliases": ["Sagosen"], "sport": "handball" },
			{ "name": "Nora Mørk", "aliases": ["Mørk"], "sport": "handball" },
			{ "name": "Magnus Carlsen", "aliases": ["Carlsen"], "sport": "chess" },
			{ "name": "Aryan Tari", "aliases": ["Tari"], "sport": "chess" },
			{ "name": "Hikaru Nakamura", "aliases": ["Nakamura"], "sport": "chess" },
			{ "name": "Fabiano Caruana", "aliases": ["Caruana"], "sport": "chess" },
			{ "name": "Ian Nepomniachtchi", "aliases": ["Nepomniachtchi", "Nepo"], "sport": "chess" },
			{ "name": "Ding Liren", "aliases": ["Ding"], "sport": "chess" },
			{ "name": "Gukesh Dommaraju", "aliases": ["Gukesh", "Gukesh D"], "sport": "chess" },
			{ "name": "Alireza Firouzja", "aliases": ["Firouzja"], "sport": "chess" },
			{ "name": "Nodirbek Abdusattorov", "aliases": ["Abdusattorov"], "sport": "chess" },
			{ "name": "Wei Yi", "aliases": [], "sport": "chess" },
			{ "name": "Rameshbabu Praggnanandhaa", "aliases": ["Praggnanandhaa", "Pragg"], "sport": "chess" },
			{ "name": "Arjun Erigaisi", "aliases": ["Erigaisi"], "sport": "chess" },
			{ "name": "Vincent Keymer", "aliases": ["Keymer"], "sport": "chess" },
			{ "name": "Anish Giri", "aliases": ["Giri"], "sport": "chess" },
			{ "name": "Levon Aronian", "aliases": ["Aronian"], "sport": "chess" },
			{ "name": "Wesley So", "aliases": [], "sport": "chess" },
			{ "name": "Håvard Nygaard", "aliases": ["rain"], "sport": "esports" },
			{ "name": "Anders Mol", "aliases": ["Mol"], "sport": "beach volleyball" },
			{ "name": "Christian Sørum", "aliases": ["Sørum", "Sorum"], "sport": "beach volleyball" }
		],
		"teams": [
			{ "name": "Barcelona", "aliases": ["FC Barcelona", "Barça", "Barca"], "sport": "football" },
			{ "name": "Lyn", "aliases": ["Lyn Oslo", "Lyn Fotball"], "sport": "football" },
			{ "name": "Bodø/Glimt", "aliases": ["Bodo/Glimt", "Glimt"], "sport": "football" },
			{ "name": "Rosenborg", "aliases": ["Rosenborg BK", "RBK"], "sport": "football" },
			{ "name": "Molde", "aliases": ["Molde FK"], "sport": "football" },
			{ "name": "Brann", "aliases": ["SK Brann"], "sport": "football" },
			{ "name": "Manchester City", "aliases": ["Man City", "Manchester City FC"], "sport": "football" },
			{ "name": "Arsenal", "aliases": ["Arsenal FC"], "sport": "football" },
			{ "name": "Real Madrid", "aliases": ["Real Madrid CF"], "sport": "football" },
			{ "name": "Liverpool", "aliases": ["Liverpool FC"], "sport": "football" },
			{ "name": "Uno-X Mobility", "aliases": ["Uno-X", "Uno-X Pro Cycling"], "sport": "cycling" },
			{ "name": "Kolstad Håndball", "aliases": ["Kolstad"], "sport": "handball" },
			{ "name": "100 Thieves", "aliases": ["100T"], "sport": "esports" },
			{ "name": "Natus Vincere", "aliases": ["NAVI", "Na'Vi"], "sport": "esports" },
			{ "name": "FaZe Clan", "aliases": ["FaZe"], "sport": "esports" },
			{ "name": "Team Vitality", "aliases": ["Vitality"], "sport": "esports" },
			{ "name": "G2 Esports", "aliases": ["G2"], "sport": "esports" },
			{ "name": "Team Spirit", "aliases": ["Spirit"], "sport": "esports" },
			{ "name": "MOUZ", "aliases": ["Mousesports", "mousesports"], "sport": "esports" },
			{ "name": "Astralis", "aliases": [], "sport": "esports" },
			{ "name": "The MongolZ", "aliases": ["MongolZ"], "sport": "esports" },
			{ "name": "Team Falcons", "aliases": ["Falcons"], "sport": "esports" },
			{ "name": "Team Liquid", "aliases": ["Liquid"], "sport": "esports" },
			{ "name": "Heroic", "aliases": [], "sport": "esports" },
			{ "name": "Complexity", "aliases": ["Complexity Gaming"], "sport": "esports" },
			{ "name": "FURIA", "aliases": ["FURIA Esports"], "sport": "esports" },
			{ "name": "Cloud9", "aliases": ["C9"], "sport": "esports" },
			{ "name": "Virtus.pro", "aliases": ["Virtus Pro"], "sport": "esports" },
			{ "name": "Eternal Fire", "aliases": [], "sport": "esports" }
		],
		"tournaments": [
			{ "name": "Premier League", "aliases": ["EPL"], "sport": "football" },
			{ "name": "Eliteserien", "aliases": ["Eliteserien 2026"], "sport": "football" },
			{ "name": "OBOS-ligaen", "aliases": ["OBOS-ligaen 2026", "1. divisjon"], "sport": "football" },
			{ "name": "La Liga", "aliases": ["LaLiga"], "sport": "football" },
			{ "name": "Serie A", "aliases": ["Italian Serie A"], "sport": "football" },
			{ "name": "Bundesliga", "aliases": ["German Bundesliga"], "sport": "football" },
			{ "name": "UEFA Champions League", "aliases": ["Champions League", "Mesterligaen"], "sport": "football" },
			{ "name": "UEFA Europa League", "aliases": ["Europa League", "Europaligaen"], "sport": "football" },
			{ "name": "UEFA Conference League", "aliases": ["Conference League", "Europa Conference League"], "sport": "football" },
			{ "name": "UEFA Nations League", "aliases": ["Nations League", "Nasjonsligaen"], "sport": "football" },
			{ "name": "NM Cupen", "aliases": ["NM cupen", "Norgesmesterskapet i fotball"], "sport": "football" },
			{ "name": "FIFA World Cup 2026", "aliases": ["World Cup 2026", "VM 2026", "Fotball-VM"], "sport": "football" },
			{ "name": "Masters Tournament", "aliases": ["The Masters", "US Masters"], "sport": "golf" },
			{ "name": "PGA Championship", "aliases": [], "sport": "golf" },
			{ "name": "The Open Championship", "aliases": ["The Open", "British Open"], "sport": "golf" },
			{ "name": "US Open Golf", "aliases": ["U.S. Open Golf"], "sport": "golf" },
			{ "name": "DP World Tour", "aliases": ["European Tour"], "sport": "golf" },
			{ "name": "Ryder Cup", "aliases": [], "sport": "golf" },
			{ "name": "FedExCup Playoffs", "aliases": ["FedEx Cup", "Tour Championship"], "sport": "golf" },
			{ "name": "F1 World Championship", "aliases": ["Formula 1", "Formula One", "Formel 1", "F1"], "sport": "f1" },
			{ "name": "Tour de France", "aliases": ["TdF"], "sport": "cycling" },
			{ "name": "Giro d'Italia", "aliases": ["Giro"], "sport": "cycling" },
			{ "name": "Vuelta a España", "aliases": ["La Vuelta", "Vuelta"], "sport": "cycling" },
			{ "name": "Milano-Sanremo", "aliases": ["Milan-San Remo"], "sport": "cycling" },
			{ "name": "Tour of Flanders", "aliases": ["Ronde van Vlaanderen", "Flandern rundt"], "sport": "cycling" },
			{ "name": "Paris-Roubaix", "aliases": [], "sport": "cycling" },
			{ "name": "Liège-Bastogne-Liège", "aliases": ["Liege-Bastogne-Liege"], "sport": "cycling" },
			{ "name": "Il Lombardia", "aliases": ["Giro di Lombardia"], "sport": "cycling" },
			{ "name": "UCI Road World Championships", "aliases": ["Sykkel-VM", "Road World Championships"], "sport": "cycling" },
			{ "name": "Arctic Race of Norway", "aliases": ["Arctic Race"], "sport": "cycling" },
			{ "name": "PostNord Tour of Denmark", "aliases": ["Danmark Rundt", "Tour of Denmark"], "sport": "cycling" },
			{ "name": "Roland-Garros", "aliases": ["French Open"], "sport": "tennis" },
			{ "name": "Wimbledon", "aliases": [], "sport": "tennis" },
			{ "name": "Australian Open", "aliases": ["AO"], "sport": "tennis" },
			{ "name": "US Open Tennis", "aliases": ["U.S. Open Tennis"], "sport": "tennis" },
			{ "name": "Nitto ATP Finals", "aliases": ["ATP Finals"], "sport": "tennis" },
			{ "name": "WTA Finals", "aliases": [], "sport": "tennis" },
			{ "name": "Davis Cup", "aliases": ["Davis Cup Finals"], "sport": "tennis" },
			{ "name": "Laver Cup", "aliases": [], "sport": "tennis" },
			{ "name": "Indian Wells Masters", "aliases": ["BNP Paribas Open", "Indian Wells"], "sport": "tennis" },
			{ "name": "Miami Open", "aliases": ["Miami Masters"], "sport": "tennis" },
			{ "name": "Monte-Carlo Masters", "aliases": ["Rolex Monte-Carlo Masters"], "sport": "tennis" },
			{ "name": "Mutua Madrid Open", "aliases": ["Madrid Open"], "sport": "tennis" },
			{ "name": "Italian Open", "aliases": ["Rome Masters", "Internazionali BNL d'Italia"], "sport": "tennis" },
			{ "name": "National Bank Open", "aliases": ["Canadian Open", "Rogers Cup"], "sport": "tennis" },
			{ "name": "Cincinnati Open", "aliases": ["Cincinnati Masters"], "sport": "tennis" },
			{ "name": "Shanghai Masters", "aliases": [], "sport": "tennis" },
			{ "name": "Paris Masters", "aliases": ["Rolex Paris Masters"], "sport": "tennis" },
			{ "name": "Wanda Diamond League", "aliases": ["Diamond League"], "sport": "athletics" },
			{ "name": "Bislett Games", "aliases": ["Bislett"], "sport": "athletics" },